{
  "$schema": "../ibc_data.schema.json",
  "chain_1": {
    "chain_name": "cosmoshub",
    "client_id": "07-tendermint-1205",
    "connection_id": "connection-933"
  },
  "chain_2": {
    "chain_name": "dymension",
    "client_id": "07-tendermint-1",
    "connection_id": "connection-1"
  },
  "channels": [
    {
      "chain_1": {
        "channel_id": "channel-794",
        "port_id": "transfer"
      },
      "chain_2": {
        "channel_id": "channel-1",
        "port_id": "transfer"
      },
      "ordering": "unordered",
      "version": "ics20-1",
      "tags": {
        "status": "live",
        "preferred": true
      }
    }
  ],
   "operators": [
    {
      "chain_1": {
        "address": "cosmos16f699curkzmvsfwn04qfr6u9es6yw7rhrq96nu"
      },
      "chain_2": {
        "address": "dym1nnxgtp6at89q4675edndcawwp9q7knhafe7xx7"
      },
      "memo": "Pro-Nodes75 Relayer",
      "name": "Pro-Nodes75",
      "discord": {
        "handle": "sw33pronodes",
        "id": "748273679711994028"
      }
    },
    {
      "chain_1": {
        "address": "cosmos1"
      },
      "chain_2": {
        "address": "dym1"
      },
      "memo": "",
      "name": "",
      "discord": {
        "handle": "",
        "id": ""
      }
    }
  ]
}
