{
  "$schema": "../ibc_data.schema.json",
  "chain_1": {
    "chain_name": "archway",
    "client_id": "07-tendermint-91",
    "connection_id": "connection-89"
  },
  "chain_2": {
    "chain_name": "dymension",
    "client_id": "07-tendermint-39",
    "connection_id": "connection-30"
  },
  "channels": [
    {
      "chain_1": {
        "channel_id": "channel-123",
        "port_id": "transfer"
      },
      "chain_2": {
        "channel_id": "channel-45",
        "port_id": "transfer"
      },
      "ordering": "unordered",
      "version": "ics20-1",
      "tags": {
        "status": "live"
      }
    }
  ],
  "operators": [
    {
      "chain_1": {
        "address": "archway1dvfr02esfgkhwxrlv6x3dcq5cy58pcvyjam438"
      },
      "chain_2": {
        "address": "dym1nnxgtp6at89q4675edndcawwp9q7knhafe7xx7"
      },
      "memo": "Pro-Nodes75 Relayer",
      "name": "Pro-Nodes75",
      "discord": {
        "handle": "sw33pronodes",
        "id": "748273679711994028"
      }
    }
  ]
}
