{
  "$schema": "../ibc_data.schema.json",
  "chain_1": {
    "chain_name": "dymension",
    "client_id": "07-tendermint-14",
    "connection_id": "connection-7"
  },
  "chain_2": {
    "chain_name": "noble",
    "client_id": "07-tendermint-79",
    "connection_id": "connection-80"
  },
  "channels": [
    {
      "chain_1": {
        "channel_id": "channel-6",
        "port_id": "transfer"
      },
      "chain_2": {
        "channel_id": "channel-62",
        "port_id": "transfer"
      },
      "ordering": "unordered",
      "version": "ics20-1",
      "tags": {
        "status": "live",
        "preferred": true
      }
    }
  ],
  "operators": [
    {
      "chain_1": {
        "address": "dym1nnxgtp6at89q4675edndcawwp9q7knhafe7xx7"
      },
      "chain_2": {
        "address": "noble15tmz024xrncl6n8kawzws6nzauua85pktjrepv"
      },
      "memo": "Pro-Nodes75 Relayer",
      "name": "Pro-Nodes75",
      "discord": {
        "handle": "sw33pronodes",
        "id": "748273679711994028"
      }
    },
    {
      "chain_1": {
        "address": "dym1"
      },
      "chain_2": {
        "address": "noble1"
      },
      "memo": "",
      "name": "",
      "discord": {
        "handle": "",
        "id": ""
      }
    }
  ]
}
